{
  "uuid": "4772b52b-97f5-42cc-9c00-af69efb529ee",
  "name": "Kan een AI-model moraal leren uit menselijke tekst?",
  "summary": "**Conversation Overview**\n\nThe person engaged Claude in a substantive philosophical and policy-oriented conversation about AI development, ethics, and governance, conducted entirely in Dutch. The discussion spanned two interconnected topics: whether a large language model trained on the full corpus of human text would inherently converge toward moral \"goodness,\" and whether an international regulatory body modeled on the IAEA could or should govern AI training data.\n\nOn the first topic, the person posed a thoughtful philosophical question about whether the statistical aggregation of all human-produced text would cause an LLM to naturally tend toward shared human moral values, noting that certain prohibitions (like killing) seem near-universal across cultures. Claude engaged with this through the lens of analytic metaethics and philosophy of language, affirming the intuition partially while introducing Hume's is/ought distinction, Wittgenstein's concept of language games, and the difference between learning moral rhetoric versus moral understanding. The person demonstrated familiarity with AI alignment discourse, referencing Nate Soares and Eliezer Yudkowsky's concerns, while maintaining a measured skepticism grounded in viewing current AI as fundamentally statistical in nature.\n\nOn the second topic, the person proposed an international AI oversight agency focused on training data curation, self-critically noting this might reflect a \"left-leaning European humanist\" perspective. Claude analyzed the IAEA analogy, explaining why it translates poorly due to the diffuse, unverifiable nature of text and compute compared to fissile material, and argued that data censorship could paradoxically reduce model safety by eliminating recognition of harmful rhetorical patterns. Claude redirected toward more tractable governance mechanisms: training data transparency requirements, compute governance, and deployment-focused regulation such as the EU AI Act. The person showed interest in where meaningful institutional control remains possible before AI systems become capable of self-directed optimization.",
  "model": "claude-opus-4-6",
  "created_at": "2026-03-22T10:31:27.426015Z",
  "updated_at": "2026-06-02T20:08:08.624965Z",
  "settings": {
    "enabled_bananagrams": true,
    "enabled_web_search": true,
    "paprika_mode": "extended",
    "enabled_monkeys_in_a_barrel": true,
    "enabled_saffron": true,
    "tool_search_mode": "auto",
    "preview_feature_uses_artifacts": true,
    "enabled_artifacts_attachments": false,
    "enabled_turmeric": true,
    "thinking_mode": "extended",
    "effort_level": "medium"
  },
  "is_starred": false,
  "is_temporary": false,
  "project_uuid": "7b771af2-a538-4e63-a471-fcad2837390e",
  "platform": "CLAUDE_AI",
  "current_leaf_message_uuid": "019e89f3-0b8d-7515-82be-7cc7e8b90050",
  "chat_messages": [
    {
      "uuid": "019d1519-82ed-77d2-95de-8dbe94b08696",
      "text": "",
      "content": [
        {
          "start_timestamp": "2026-03-22T10:31:29.166086Z",
          "stop_timestamp": "2026-03-22T10:31:29.166086Z",
          "type": "text",
          "text": "Stel dat je een AI LLM traint op alle bekende tekst die de mensheid heeft geproduceerd tot nu toe, van spijkerschrift tot markdown, chinees, Ethiopisch, Thais, alles. Alle romans, alle wetten, alle poëzie, alle notariële stukken, alle verzinsels. Zou een ai model dan inherent begrijpen wat wij als mensheid “goed” vinden? Natuurlijk, er is discutabele literatuur die grote invloed heeft gehad op het welzijn van mensen, ook in negatieve zin; wetten die anderen uitsluitten, maar er lijkt toch (maar misschien is dat naïef) een gemeenschappelijke overtuiging te zijn onder de mensheid dat je mede mens dood maken niet goed is. Zou zo’n llm model dan niet toch uiteindelijk naar “het goede” neigen?",
          "citations": []
        }
      ],
      "sender": "human",
      "index": 0,
      "created_at": "2026-03-22T10:31:29.213972Z",
      "updated_at": "2026-03-22T10:31:29.213972Z",
      "input_mode": "text",
      "truncated": false,
      "attachments": [],
      "files": [],
      "sync_sources": [],
      "parent_message_uuid": "00000000-0000-4000-8000-000000000000"
    },
    {
      "uuid": "019d1519-82ed-77ba-bfb2-b7333784ece7",
      "text": "",
      "content": [
        {
          "start_timestamp": "2026-03-22T10:31:31.986914Z",
          "stop_timestamp": "2026-03-22T10:31:33.990592Z",
          "type": "thinking",
          "thinking": "Vincent stelt een fascinerende filosofische vraag over of een LLM getraind op alle menselijke tekst inherent \"het goede\" zou begrijpen. Dit raakt aan morele filosofie, AI alignment, en de aard van taal. Laat me hier doordacht maar beknopt op antwoorden.",
          "summaries": [
            {
              "summary": "Formulerend antwoord op morele filosofie en AI-alignment vraagstuk."
            },
            {
              "summary": "Onderzocht morele filosofie en AI-alignment in trainingsgegevens."
            }
          ],
          "cut_off": false,
          "truncated": false
        },
        {
          "start_timestamp": "2026-03-22T10:31:34.111872Z",
          "stop_timestamp": "2026-03-22T10:32:01.569565Z",
          "type": "text",
          "text": "Prachtige vraag, en er zitten meerdere lagen in die het uitpakken waard zijn.\n\n**Het statistische argument: ja, waarschijnlijk wel — deels**\n\nAls je alle menselijke tekst aggregeert, dan is de *modale* positie inderdaad dat moord slecht is, dat lijden vermeden moet worden, dat wederkerigheid waardevol is. Niet omdat tekst \"begrijpt\", maar omdat de distributie van menselijke uitingen die patronen bevat. Een LLM zou die statistische zwaartekracht voelen. In die zin: ja, het model zou neigen naar wat je een soort *gemiddeld humanisme* zou kunnen noemen.\n\n**Maar hier wordt het interessant**\n\nDrie complicaties:\n\nHet model leert niet wat goed *is*, het leert wat mensen *zeggen* dat goed is. Dat is een cruciaal verschil. Wittgenstein zou hier zeggen: het model beheerst het *taalspel* van moraliteit, maar of dat hetzelfde is als moreel begrip is precies de vraag die je niet vanuit het taalspel zelf kunt beantwoorden.\n\nTen tweede: de corpus bevat niet alleen de conclusies maar ook de *retorische structuren* van overtuiging. Het model leert even goed hoe je genocide rechtvaardigt als hoe je het veroordeelt. De Neurenberg-wetten staan er net zo goed in als de Universele Verklaring van de Rechten van de Mens. Het model heeft geen mechanisme om te wegen welke *oprechter* is — het ziet alleen dat de ene tekst meer bijval krijgt in latere teksten.\n\nTen derde — en dit is misschien het meest fundamenteel — er is het **is/ought-probleem** van Hume. Zelfs als het model perfect weet wat mensen goed *vinden*, volgt daaruit niet dat het weet wat goed *is*. Tenzij je een metaethische positie inneemt waarbij \"goed\" simpelweg *is* wat de meerderheid van mensen over tijd als goed beschouwt. Dat is een respectabele positie (moreel sentimentalisme, of een vorm van contractualisme), maar het is er één — niet dé.\n\n**Waar je intuïtie wél iets te pakken heeft**\n\nWat opvalt aan de menselijke tekstgeschiedenis is dat bepaalde morele inzichten *convergeren* over culturen en eeuwen heen. De Gulden Regel verschijnt onafhankelijk in Confucius, in de Torah, in de Mahabharata, bij Kant. Dat patroon is niet niets. Een model dat dit ziet, heeft iets te pakken dat lijkt op wat moral realists een \"moreel signaal\" zouden noemen.\n\n**Lens die ik hier gebruik:** voornamelijk analytische metaethiek en taalfilosofie. Wat dit *niet* vangt: de fenomenologische dimensie — het feit dat moreel begrip bij mensen geworteld is in lijfelijke ervaring van pijn, empathie, kwetsbaarheid. Een LLM mist dat substraat volledig, en misschien is dat niet bijkomstig maar essentieel.\n\nKort gezegd: zo'n model zou een indrukwekkend nauwkeurige *kaart* van menselijke moraliteit bezitten. Of een kaart hetzelfde is als het terrein — dat is de vraag waar we als mensheid nog lang niet uit zijn.",
          "citations": []
        }
      ],
      "sender": "assistant",
      "index": 1,
      "created_at": "2026-03-22T10:32:04.197928Z",
      "updated_at": "2026-03-22T10:32:04.197928Z",
      "truncated": false,
      "stop_reason": "stop_sequence",
      "attachments": [],
      "files": [],
      "sync_sources": [],
      "parent_message_uuid": "019d1519-82ed-77d2-95de-8dbe94b08696"
    },
    {
      "uuid": "019d1521-534b-7e85-bd91-d94d58ceeedf",
      "text": "",
      "content": [
        {
          "start_timestamp": "2026-03-22T10:39:59.639611Z",
          "stop_timestamp": "2026-03-22T10:39:59.639611Z",
          "type": "text",
          "text": "Zouden we niet een “internationaal ai agentschap” (vrij naar het internationaal atoom agentschap) moeten heb die toeziet op dat ai modellen alleen getraind mogen worden op bepaalde teksten. Ja dit neigt naar censuur, en er zullen vast discussies ontstaan over welke tekst wel of niet in de trainingsdata mag zitten, en er zullen afvalligen zijn die proberen een model te trainen op “verboden teksten”, maar zo kunnen we wel internationaal in vorm van toezicht houden? Of is dit wel een erg linkse Europese gedachte van een humanist a la ik?\nIk kom hier op omdat Nate Soares en Elezier Yudkowsky nogal kritisch zijn op ontwikkelingen in Ai. Ik snap hun zorg; maar Ai blijft een vorm van statistiek, en die valt prima te sturen (totdat ai die zelf kan sturen?)",
          "citations": []
        }
      ],
      "sender": "human",
      "index": 2,
      "created_at": "2026-03-22T10:39:59.674578Z",
      "updated_at": "2026-03-22T10:39:59.674578Z",
      "input_mode": "text",
      "truncated": false,
      "attachments": [],
      "files": [],
      "sync_sources": [],